,date,tweet,hashtags
4,2021-04-29,Lembrete!  Psicoterapia é 10% técnicas e ferramentas e 90% vínculo.  #saudemental #psicologia #psicoterapia,"#saudemental, #psicologia, #psicoterapia"
6,2021-04-28,"Referência: Wright, J. H., Basco, M. R., &amp; Thase, M. E. (2008). Aprendendo a terapia cognitivo-comportamental: um guia ilustrado. Porto Alegre: Artmed.  #psicologia #psicoterapia  #saúde #mente #saúdemental  #transtornosdeansiedade #transtornodeansiedade #ansiedade","#psicologia, #psicoterapia, #saúde, #mente, #saúdemental, #transtornosdeansiedade, #transtornodeansiedade, #ansiedade"
8,2021-04-28,Não pare de andar! 👍🏻😉😼  #psicologia #psicologo #saudemental ##saudeemocional #terapiacognitiva #terapiacognitivocomportamental #cognitivebehavioraltherapy #psicoterapia #presidenteprudente #terapeuta #consultório #boanoite,"#psicologia, #psicologo, #saudemental, #saudeemocional, #terapiacognitiva, #terapiacognitivocomportamental, #cognitivebehavioraltherapy, #psicoterapia, #presidenteprudente, #terapeuta, #consultório, #boanoite"
13,2021-04-28,"Tuite do meio dia!   Você precisa se sentir feliz pelo que você tem, e onde você está, não importa onde e como esteja, sua felicidade deve ser aí.   #Existencia #Psicologia #Psicoterapia #razao #ciencia #sucesso #felicidade #Autoestima #autoconhecimento #vida","#Existencia, #Psicologia, #Psicoterapia, #razao, #ciencia, #sucesso, #felicidade, #Autoestima, #autoconhecimento, #vida"
14,2021-04-28,"""Perder-se também é caminho"" (Clarisse Lispector) #relacionamentos #psicoterapia #saúdemental","#relacionamentos, #psicoterapia, #saúdemental"
17,2021-04-27,"Bem, isso se chama imaturidade. Mas será que você não cresceu por que não quis? Não! Você está onde está porque foi tudo o que deu para fazer, era tudo o que você sabia e podia fazer. #psicoterapia",#psicoterapia
23,2021-04-27,"A palavra que sai ou a que fica, é sempre dita. As não ditas para fora, costumam ficar dizendo para dentro.   #psicologia #psicoterapia #falar","#psicologia, #psicoterapia, #falar"
28,2021-04-26,"O Ressentimento é quando, através de nossa memória, ficamos sentindo novamente aquilo que sentimos em situação passada. O problema do ressentimento é que ele nos impede de ter novos sentimentos em relação às pessoas e a novas situações. Com ele vivemos no passado... #psicoterapia",#psicoterapia
30,2021-04-26,"Hábitos como respeitar os próprios limites, ser responsável com as próprias ações e fazer psicoterapia são ótimos recursos para o autocuidado, principalmente do ponto de vista psicológico e emocial.   #saúdementalimporta #psicoterapia","#saúdementalimporta, #psicoterapia"
39,2021-04-24,Falar só é terapêutico quando a escuta é qualificada #Terapia #psicoterapia,"#Terapia, #psicoterapia"
47,2021-04-23,"""Use a dor como uma pedra em seu caminho e não coml uma área pra acampar.""  Alan Cohen  #psicoterapia #psicologoemfortaleza #psicoterapia #bbb21 #redebbb  @psi_alcircaniggia","#psicoterapia, #psicologoemfortaleza, #psicoterapia, #bbb21, #redebbb"
52,2021-04-23,"Sábado agora não é mais dia de folia, de descanso, de piscina, de dança. Meus sábados de manhã são de atendimentos à pessoas enlutadas, deprimidas, ansiosas, ou que querem ter um momento mara de autoconhecimento #Psicoterapia",#Psicoterapia
56,2021-04-23,"Psicóloga Clínica | Pós Graduanda em Neuropsicologia | CRP 08/27543 “De uma chance para você mesmo, cuidar da sua saúde mental é muito importante, faça psicoterapia!” #Psicologia #psicólogaonline #psicoterapia #saudemental","#Psicologia, #psicólogaonline, #psicoterapia, #saudemental"
59,2021-04-22,"...cada choro, seja ele por motivo bons ou ruins,cada momento está arquivado na sua cabeça, então enquanto a sua cabeça diz sobre Você já pensou nisso? #psicoterapia #psicanalise #psychoanalysis #hipnoseclinica #autoconhecimento #autocuidado","#psicoterapia, #psicanalise, #psychoanalysis, #hipnoseclinica, #autoconhecimento, #autocuidado"
61,2021-04-22,permanecerem em união com os entes amados. Espero que eu tenha ajudado vocês um pouquinho com o compartilhamento desde conhecimento ! 💭 #psicologia  #psicoterapia  #psicoterapiaonline #terapiacognitivocomportamental #motivacao #emoção #comportamento  #mudepensamentos,"#psicologia, #psicoterapia, #psicoterapiaonline, #terapiacognitivocomportamental, #motivacao, #emoção, #comportamento, #mudepensamentos"
69,2021-04-21,Parecia a Freud que as pessoas gostam de dar murro em ponta de faca – procuram irracionalmente repetir uma vivência negativa.   #psicanalista #psicanalise #psicologia #freud #lise #psican #terapia #psicoterapia #o #saudemental #autoconhecimento #lacan #psic #psicanaliseclinica,"#psicanalista, #psicanalise, #psicologia, #freud, #lise, #psican, #terapia, #psicoterapia, #saudemental, #autoconhecimento, #lacan, #psic, #psicanaliseclinica"
71,2021-04-21,"Quando alguém te dizer “Você é muito sensível, leva as coisas sempre ao extremo”. Lembre-se: Seus sentimentos são válidos♥️  #saudemental #psicoterapia","#saudemental, #psicoterapia"
92,2021-04-19,"Segundou com S de:  Sei-lá se tenho muito tempo para amar. Vou amar agora, antes que seja  terça e nem amei hoje. Afinal, S também é de Salvação e o amor salva.  #amor #pitadapsi #tiagolupoli #psicoterapia #amorsalva #bemestar #sejabom","#amor, #pitadapsi, #tiagolupoli, #psicoterapia, #amorsalva, #bemestar, #sejabom"
102,2021-04-17,Ansiedade é a mente indo mais rápido que a vida.  #ansiedade #psicoterapia #psicologia #vidaopresente,"#ansiedade, #psicoterapia, #psicologia, #vidaopresente"
114,2021-04-15,Quais os apegos estão limitando meu processo par receber coisas novas?! Reflita e lembre-se: A psicoterapia pode te ajudar nesse processo. ✨ Para agendamentos- 11 9744-5450 🤝 Thalita Bahls- Psicóloga de abordagem humanista e Terapeuta Reiki. 💙 . . . . . . #Psicoterapia,#Psicoterapia
120,2021-04-15,"Você faz terapia?! 🤔🔱 Se não faz, qual o motivo?  #Psicologia #psicoterapia #autoamor","#Psicologia, #psicoterapia, #autoamor"
128,2021-04-14,até por pessoas que julgamos ser iguais a nós.  Só atenção para não rejeitarem si próprios. Este é o pior ‘não’.  PS: terapia ajuda demais.  #doutormaravilha #wonderdoctor #saudelgbt #lgbthealth #prephiv #infectologia #infectologista #rejeição #psicoterapia #gaysp,"#doutormaravilha, #wonderdoctor, #saudelgbt, #lgbthealth, #prephiv, #infectologia, #infectologista, #rejeição, #psicoterapia, #gaysp"
135,2021-04-13,Sabe aquele objetivo que parece muito longe pra ser alcançado?  Garanto que ele fica mais próximo a cada passo!  “A única jornada impossível é aquela que você nunca começa” - Anthony Robbins  #Psicologia #psicoterapia #SaudeMental #autoconfiança,"#Psicologia, #psicoterapia, #SaudeMental, #autoconfiança"
138,2021-04-13,A birra é uma maneira de se expressar utilizada pela criança que ainda não tem repertório suficiente para verbalizar suas emoções.   #Educacao #ParentalAlienation #orientacaoparental #Terapia #Psicologia #infancia #emociones #psicoterapia #comportamento,"#Educacao, #ParentalAlienation, #orientacaoparental, #Terapia, #Psicologia, #infancia, #emociones, #psicoterapia, #comportamento"
163,2021-04-10,Se por em primeiro lugar não é egoísmo. É cuidado consigo mesmo! #psico #psicologia #Psicoterapia #psychology #FolloForFolloBack #SabadoDetremuraSDV,"#psico, #psicologia, #Psicoterapia, #psychology, #FolloForFolloBack, #SabadoDetremuraSDV"
164,2021-04-09,Um sonho tornando-se em realidade! Gratidão! #Psicólogo #PsicólogoClínico #Psicoterapia,"#Psicólogo, #PsicólogoClínico, #Psicoterapia"
170,2021-04-09,Muitos problemas pra zero saúde mental  #psicoterapia #solutions,"#psicoterapia, #solutions"
173,2021-04-08,"Escreva pra mim, sua boba! 👀  #Psicoterapia  #PsicoterapiaOnline  #Covid  #Depressão  #Ansiedade #Sofrimento","#Psicoterapia, #PsicoterapiaOnline, #Covid, #Depressão, #Ansiedade, #Sofrimento"
179,2021-04-08,"💡 Acho a pergunta ""quer conversar sobre isso?"" Uma das mais bonitas, ela demonstra interesse e respeito pelo espaço do outro.  💙🌻💜 #psicoterapia#falarfazbem",#psicoterapia
189,2021-04-07,"A pessoa que acaba com a sua saúde mental não pode ser o grande amor da sua vida. Não romantize relações abusivas, sejam elas: amorosas  familiares ou amizades.  #Psicologia #relacionamento #relacao #abusopsicologico #Terapia #psicoterapia #psicología #terapia","#Psicologia, #relacionamento, #relacao, #abusopsicologico, #Terapia, #psicoterapia, #psicología, #terapia"
195,2021-04-07,Remodelar o padrão das relações sociais é reordenar as coordenadas do mundo experimentado. As formas da sociedade são a substância da cultura. Clifford Geertz  #psicologia #psicoterapia #frases #quotes #psicologo,"#psicologia, #psicoterapia, #frases, #quotes, #psicologo"
200,2021-04-06,"As vezes a gente morre de medo de perder uma pessoa, mas quando acaba vê que foi a melhor coisa que poderia ter acontecido. - Amanda Fitas  #Terapia #Psicologia #psicoterapia #amor #relacionamentos","#Terapia, #Psicologia, #psicoterapia, #amor, #relacionamentos"
209,2021-04-05,Berço da necro-política. Impossível ficar bem nesse contexto. O social é muito importante também. Sem o social as dimensões bio e psico ficam capengas. (2/2) #psicologia #psicoterapia #psisocial  #negacionismo #Genocida #necropolítica #ImpeachmentDeBolsonaroUrgente #ForaGuedes,"#psicologia, #psicoterapia, #psisocial, #negacionismo, #Genocida, #necropolítica, #ImpeachmentDeBolsonaroUrgente, #ForaGuedes"
210,2021-04-05,verbo importante ao aparecer em #psicoterapia: ressarcir,#psicoterapia
248,2021-04-01,Sim! Ta certo! É isso mesmo! Psicoterapia é coisa de Louco de Doido e de Fraco!  É também frescura e não tem resultados maravilhosos!  Não façam! Muito menos comigo...  #AprilFoolsDay #1DeAbril #Psicoterapia,"#AprilFoolsDay, #1DeAbril, #Psicoterapia"
253,2021-03-31,"Se alguém ai quiser formar un Cartel, manda uma DM!  #piscanálise #psicanalistas #lacan #freud #terapia #psicoterapia #SessaodeTerapia #psi #psicologia #cartel #carteis #cartelpsicanálise","#piscanálise, #psicanalistas, #lacan, #freud, #terapia, #psicoterapia, #SessaodeTerapia, #psi, #psicologia, #cartel, #carteis, #cartelpsicanálise"
255,2021-03-31,"""O sentir é particular""  #psicologia #psicoterapia","#psicologia, #psicoterapia"
262,2021-03-30,Obrigado Big Brother pela valorização da Psicoterapia. Psicoterapia é com Psicólogo. #psicoterapia #BBB21 #bbb #ParedaoBBB #projota #thais #pocah #juliette #sarah #bbb21aovivo #gildovigor #fiuk #arthurpicoli #TeamJuliette #TeamFiuk #TeamGil #TeamSarah  #euliette,"#psicoterapia, #BBB21, #bbb, #ParedaoBBB, #projota, #thais, #pocah, #juliette, #sarah, #bbb21aovivo, #gildovigor, #fiuk, #arthurpicoli, #TeamJuliette, #TeamFiuk, #TeamGil, #TeamSarah, #euliette"
263,2021-03-30,BBB ressaltando a importância de se fazer terapia! ❤️  #BBB21 #psicoterapia #SaudeMental,"#BBB21, #psicoterapia, #SaudeMental"
264,2021-03-30,que especial o #bbb21 falar tão abertamente sobre TERAPIA! sobre psicologia. como eu queria que todo mundo tivesse a oportunidade de fazer terapia ❤️🥰❤️🥰❤️ #psicoterapia #redebbb,"#bbb21, #psicoterapia, #redebbb"
265,2021-03-30,Errou?  elabore sua culpa e o outro elabora a decepção que você causou. Já adianto que elaborar decepção é menos sofrido. E se você não sente culpa.. tenho uma péssima notícia pra você. #psicoterapia,#psicoterapia
266,2021-03-30,"Os dias já estão pesados demais! Espalhe o amor, empatia, espalhe sentimentos bons, não se tornem frios em meio todo esse caos. Sinta! Fale! Se expresse! Esteja presente como puder, o máximo que puder! #COVID19 #pandemia #ansiedade #PsicologíaClínica #psicoterapia","#COVID19, #pandemia, #ansiedade, #PsicologíaClínica, #psicoterapia"
278,2021-03-28,"Você quer que a vida siga como era antes, mas será que antes você estava de fato vivendo,  ou estava meramente existindo? #psicologia #PsicologíaClínica #psicoterapia","#psicologia, #PsicologíaClínica, #psicoterapia"
307,2021-03-25,Bom dia pra quem já acordou com problemas da família na mente chegando pelo zap. É nisso que eu vou focar depois que conseguir treinar minha mente conta os maus pensamentos. #Psicologo #psicologia #Psicoterapia,"#Psicologo, #psicologia, #Psicoterapia"
317,2021-03-24,"Tem coisas que é simples, a gente que insiste em não acreditar e lá na frente... Acaba doendo em dobro.   Trecho do livro Detox emocional   #psicoterapia #saudemental #autoestima #Psicología","#psicoterapia, #saudemental, #autoestima, #Psicología"
322,2021-03-24,"Auto cuidado vai muito além de cabelo hidratado, uma pele hidratada, rotina de skincare em dia. É dar a você, a mesma atenção que você dá aos outros. Vai muito além da estética.  #psicoterapia #autocuidado #menteabierta #equilibrioemocional","#psicoterapia, #autocuidado, #menteabierta, #equilibrioemocional"
334,2021-03-23,"Quem tem depressão/ansiedade sabe...os monstrinhos da mente ficam doidos pra sair a qualquer momento, só precisa de uma faísca.  E conviver com quem não se trata adequadamente (psicoterapia), só atrasa o processo.   Forças pra nós.   #Ansiedade #Depressão #Psicoterapia #BomDia","#Ansiedade, #Depressão, #Psicoterapia, #BomDia"
342,2021-03-20,toda gratidão eu tenho pelos meus médicos que me acompanham  eu me sinto cuidada e aprendi muito sobre mim mesma nos últimos 6 meses #psicoterapia #borderlinepersonalitydisorder,"#psicoterapia, #borderlinepersonalitydisorder"
371,2021-03-16,"Mainha tá fazendo terapia há meses e eu já observei que ela tá menos estressada. Comentei e ela falou: me sinto menos estressada mesmo, minha psicóloga Tb notou. Quando a mudança é real. #Psicoterapia é vida 🌷❣️🥰",#Psicoterapia
380,2021-03-15,Muitos psicólogos também costumam classificar o luto em etapas. 1️⃣Negação 2️⃣Raiva 3️⃣Negociação 4️⃣Depressão 5️⃣Aceitação  #luto #psicologia #fortaleza #psicoterapia,"#luto, #psicologia, #fortaleza, #psicoterapia"
383,2021-03-15,"To procurando bons perfis de Psicólogos (homens) no insta, me ajuda ai se vc leu. #Psicoterapia #Psicologia","#Psicoterapia, #Psicologia"
403,2021-03-11,"E há ainda aqueles que nunca aprenderam à fazer uma limonada, você já pensou nisso?  Portanto, cuide-se!   #psicoterapia #psicologia #resiliencia #pandemia #coronavirus #covid19","#psicoterapia, #psicologia, #resiliencia, #pandemia, #coronavirus, #covid19"
412,2021-03-09,Coloque aqui o que você entende sobre fazer terapia 👇🏾#psicoterapia,#psicoterapia
438,2021-03-05,Um relacionamento que eu torço para dar certo é entre minha MENTE e EU.   #psicologia #psicoterapia #terapia #saudemental #amor #autoconhecimento #vida #amorproprio #autoestima #ansiedade,"#psicologia, #psicoterapia, #terapia, #saudemental, #amor, #autoconhecimento, #vida, #amorproprio, #autoestima, #ansiedade"
447,2021-03-03,"Venha, desbravar-se... a psicoterapia é uma jornada de autoconhecimento e, consequentemente, de autocuidado. Aventure-se em si mesmo e floresça!  #psicologia #psicanalise #psicoterapia #autoconhecimento #autocuidado #saudeemocional #saudemental #crescimentopessoal #criatividade","#psicologia, #psicanalise, #psicoterapia, #autoconhecimento, #autocuidado, #saudeemocional, #saudemental, #crescimentopessoal, #criatividade"
452,2021-03-02,"quando você tenta “forçar” gostar da pessoa, pq ela é maravilhosa mas você não consegue pq algo está errado em você #psicoterapia",#psicoterapia
454,2021-03-02,No sentir nada como forma de evitar el dolor. #Psicologia #psicoterapia #apego #EMDR,"#Psicologia, #psicoterapia, #apego, #EMDR"
456,2021-03-02,"""Quando eu acordo e lembro que é dia de terapia! Alguém mais acorda assim?"" #saúdemental #psicoterapia","#saúdemental, #psicoterapia"
482,2021-02-26,"Uma frase que é muito usada pra perpetuar abusos: ""pare de se fazer de vítima"".  A gente já sabe que reagir, enfrentar situações, faz bem.  Essa frase silencia muita coisa.  Parem vcs de normalizar violência psicológica. #saudemental #psicoterapia","#saudemental, #psicoterapia"
489,2021-02-25,"Antes de você falar, ouça. Antes de agir, pense. Antes de criticar, conheça. E antes de desistir, tente. #psico #Psicoterapia","#psico, #Psicoterapia"
492,2021-02-24,"A dificuldade em estabelecer mudanças é comum e a terapia te ajuda a entender o que está por trás desses comportamentos, identificar a sua resposta emocional e a substituir respostas automáticas por outras, + saudáveis #psicoterapia",#psicoterapia
510,2021-02-23,"É tão bom poder falar tudo que estamos passando/sentindo/pensando para alguém que não irá nos julgar, mesmo quando nós já estamos nos julgando, a pessoa apenas acolhe e compreende, toda a culpa e peso vão embora, dando lugar à clareza.  Mto grata à minha psicóloga. #psicoterapia",#psicoterapia
539,2021-02-18,"Meu psico me defendendo de mim mesma: - você cumpriu o seu papel nesse relacionamento, não digo 100% pq isso ngm pode ser, mas o respeito e a dedicação estavam apenas do seu lado!! #terapia #psicoterapia","#terapia, #psicoterapia"
541,2021-02-18,Venhamxs por meio deste trazer e ser sui generis em essência!  #psicologia #rpg #psicoterapia #terapia #psicoprosa #ficção #histórias #identidade #projeto #descrição #terapeuta #psicólogo #paciente #arte #escrita #criativo #artístico #subjetividade #existência #suigeneris,"#psicologia, #rpg, #psicoterapia, #terapia, #psicoprosa, #ficção, #histórias, #identidade, #projeto, #descrição, #terapeuta, #psicólogo, #paciente, #arte, #escrita, #criativo, #artístico, #subjetividade, #existência, #suigeneris"
545,2021-02-18,"Aprendam a naturalizar a palavra “não” , pq vou tacar o foda-se agora.  Aah 😌 Como é bom a tal da #psicoterapia né.",#psicoterapia
561,2021-02-16,"Em sessão de terapia.  Paciente:   Eu penso que (silêncio), Vir pra cá (consultório) e sair depois é como se fosse uma esponja de louça pesada e encharcada com água e sabão, daí você fala e ela fica leve e limpa.  Adolescente, 16 anos.  #Psicoterapia #saudemental","#Psicoterapia, #saudemental"
572,2021-02-13,"Sabe por o ansioso está sempre cansado? Porque viver com receito, pensando e elaborando formas de evitar algo ruim que pode não acontecer é extremamente cansativo.  #ansiedade #saudemental #Psicologia #psicoterapia #psicologa #saude á","#ansiedade, #saudemental, #Psicologia, #psicoterapia, #psicologa, #saude"
580,2021-02-11,Tomar decisões não tem a ver com ter certezas! #psi #psicoterapia #terapiaonline #terapia #gestalt,"#psi, #psicoterapia, #terapiaonline, #terapia, #gestalt"
589,2021-02-10,"“não estou neste mundo para viver de acordo com as suas expectativas. e nem você o está para viver de acordo com as minhas. eu sou eu, você é você. se por acaso nos encontrarmos, é lindo. se não, não há o que fazer.”                                    Fritz Perls   #psicoterapia",#psicoterapia
592,2021-02-10,...e que de alguma forma estão fazendo seu corpo reagir para cuidar mais de você!  Psicólogo Handré G. Hermann CRP 04/58640  #psicologia #psicoterapia #desenvolvimentohumano #ansiedade #depressao #saudemental #bemestar,"#psicologia, #psicoterapia, #desenvolvimentohumano, #ansiedade, #depressao, #saudemental, #bemestar"
594,2021-02-10,"Às vezes, você vai fazer de tudo por alguém, e mesmo assim não será suficiente. Não significa que você seja pequeno, mas sim, que o vazio do outro é imenso. #relacionamentos #psicologaonline #mulher #amorproprio #psicoterapia #Terapia #relacionamentosabusivos","#relacionamentos, #psicologaonline, #mulher, #amorproprio, #psicoterapia, #Terapia, #relacionamentosabusivos"
595,2021-02-09,"Minha terapeuta saiu de férias, pronto! Agora preciso usar o Twitter pra falar de tudo! Hahahha #SaudeMental #psicoterapia","#SaudeMental, #psicoterapia"
632,2021-02-03,"Somos acima de tudo humanos! Também passamos por dificuldades, também somos impactados pelo meio que estamos inseridos e também precisamos de ajuda!  #psicoterapia #psicologia #clinicacomportamental #reflexao #BBB21","#psicoterapia, #psicologia, #clinicacomportamental, #reflexao, #BBB21"
651,2021-01-31,"Termino deixando um grande abraço a todos aqueles que não se sentem tão inteiros. Não estão sós. Procurem um espaço que vos ensine isso, que vos ajude a ultrapassar os dias menos bons. Eu continuarei no meu espaço a lutar por mim. #saúdemental #apoiopsicológico #psicoterapia","#saúdemental, #apoiopsicológico, #psicoterapia"
658,2021-01-30,"O medo nos paralisa, transforme o medo em ação...  #psicoterapia #autocohecimento","#psicoterapia, #autocohecimento"
666,2021-01-29,Escolher seu caminho significa abrir mão do caminho que os outros fizeram. #autoconhecimento #psicoterapia #psicologafortaleza #sefazsentirfazsentido,"#autoconhecimento, #psicoterapia, #psicologafortaleza, #sefazsentirfazsentido"
672,2021-01-28,"“A confiança, como a arte, nunca tem todas as respostas, mas está aberta a todas as perguntas”. Earl Gray Stevens  #Psicologia #NovaIguaçu #Psicoterapia #Psicologia #autoconhecimento","#Psicologia, #NovaIguaçu, #Psicoterapia, #Psicologia, #autoconhecimento"
713,2021-01-25,"Cheguei a uma conclusão: #psicoterapia não é prestação de serviço. Psicoterapia é um relacionamento. Então não envolve venda, mas sim encantamento. #rimou","#psicoterapia, #rimou"
720,2021-01-24,"Faça terapia!  Ficou com dúvidas? Eu posso te ajudar! Me envie sua mensagem🌹 Agenda aberta, consulte nossos horários. 🌻Psicóloga Cláudia Ferreira G de Oliveira 📍CRP: 05/59223 ☎(22)998340034 - Agende sua consulta! (Atendimento on-line e presencial).  #Psicóloga #Psicoterapia","#Psicóloga, #Psicoterapia"
729,2021-01-22,"Compreender o predador significa tornar-se um animal maduro pouco vulnerável à ingenuidade, inexistência e insensatez.”  (Clarissa Pinkola Estés, 2014)  #autoestima  #autoimagem  #amorproprio  #autoconhecimento  #psicoterapia  #psivanessawerneck","#autoestima, #autoimagem, #amorproprio, #autoconhecimento, #psicoterapia, #psivanessawerneck"
744,2021-01-20,"2021 o ano da esperança...E vamos ao trabalho cuidar da saúde mental das pessoas, teremos muito trabalho pela frente!!!  #pospandemia #psicoterapia #vemvacina #saudemental #2021esperança","#pospandemia, #psicoterapia, #vemvacina, #saudemental, #2021esperança"
745,2021-01-20,Sentiu Pânico e muito medo de morrer de CoVID19?  #pandemia #BolsonarismoMata #ForaPazuello #Psicoterapia,"#pandemia, #BolsonarismoMata, #ForaPazuello, #Psicoterapia"
771,2021-01-18,#enem2020 Ei vc que faz psicoterapia... Vc tem vergonha de marcar na rede social seu psicólogo e/ou a clinica?  Tema do #Enem2020. Oportuno demais. #Saúdemental  #JaneiroBranco  #psicoterapia,"#enem2020, #Enem2020, #Saúdemental, #JaneiroBranco, #psicoterapia"
793,2021-01-15,Mas estava aí bem ao alcance dos seus olhos!!  O que está mudando ao seu redor que você não está conseguindo perceber?  Vânia Elme  #autoconhecimento #psicoterapia #lifecoaching #palestramotivacional #vaniaelme,"#autoconhecimento, #psicoterapia, #lifecoaching, #palestramotivacional, #vaniaelme"
808,2021-01-13,As vezes o óbvio precisa ser dito! #Psicologia #Psicoterapia #TerapiaCognitiva,"#Psicologia, #Psicoterapia, #TerapiaCognitiva"
813,2021-01-12,"+encontrar significado em sua vida. Esse é o começo de fazer as pazes consigo mesmo"". #terapia #Psicoterapia #psicologa #psicologabh #mentesã","#terapia, #Psicoterapia, #psicologa, #psicologabh, #mentesã"
836,2021-01-09,Psicóloga: Gato o que te faz buscar psicoterapia?  Gato: Surtei e atirei pau na Dona Chica! #psicoterapia #busqueajuda,"#psicoterapia, #busqueajuda"
838,2021-01-08,Sextou com S de saúde mental ✨🧠 #Psicologia #sextou #PsicologiaClínica #terapiacognitivocomportamental #TCC #psicoterapia #psicoterapiaonline #psicologiaorganizacional #recursoshumanos #rh,"#Psicologia, #sextou, #PsicologiaClínica, #terapiacognitivocomportamental, #TCC, #psicoterapia, #psicoterapiaonline, #psicologiaorganizacional, #recursoshumanos, #rh"
863,2021-01-03,@showdavida ótima reportagem sobre os #psicodelicos .... tomara que pacientes e profissionais tenham escutado bem ... “ uso recreativo não é Medicina” .... e sobretudo NÃO EXISTE SOLUÇÃO MÁGICA!!!!!! #depressão #tept #medo #psicoterapia #neurociencia,"#psicodelicos, #depressão, #tept, #medo, #psicoterapia, #neurociencia"
864,2021-01-03,🧪 Neurocientistas e terapeutas relatam que uso de #psicodélicos podem avançar nos tratamentos de diminuição do medo para pacientes de estresse pós-traumáticos e depressão #MDA e #psicoterapia,"#psicodélicos, #MDA, #psicoterapia"
865,2021-01-03,Fantástico falando sobre o tratamento de substâncias psicodélicas no tratamento para depressão. #LSD #dmt #MDMA #ayahuasca #psicoterapia #Fantastico,"#LSD, #dmt, #MDMA, #ayahuasca, #psicoterapia, #Fantastico"
888,2020-12-30,Hipnose para mudar vidas. Sou Hipnólogo Master. #hipnoseclinica #hipnoterapia #psicoterapia #hipnose,"#hipnoseclinica, #hipnoterapia, #psicoterapia, #hipnose"
929,2020-12-23,"Bukowski não era um escritor tão positivo, entretanto, sua frase inspira esperança. 🥰  Por estarmos vivendo em uma pandemia, em tempos tão sombrios e incertos, o ato de acreditar em dias melhores se faz importante.  . . . #psicologia #psicoterapia #psicologa #hope","#psicologia, #psicoterapia, #psicologa, #hope"
953,2020-12-19,"Assistindo o episódio de ""Existir e Resistir: o Desafio da Depressão"", no #DiscoveryChannel, só vi muito foco na medicalização, no tratamento psiquiátrico, psicoterapia pouco mencionado, sendo sua importância fundamental para tratamento da doença! #depressãoédoença #psicoterapia","#DiscoveryChannel, #depressãoédoença, #psicoterapia"
